Welcome;Welcome to our prototype!;Velkommen til vores prototype!;
Supported_languages;Supported languages: ;Tilgængelige sprog: ;
Select_language;Please select a language> ;Vælg et sprog> ;
Select_date;Please enter the current date (DD/MM format)> ;Indtast den nuværende dato (DD/MM format)> ;
Select_hour;Please enter the current hour (HH format)> ;Indtast den nuværende time (TT format)> ;
Tomorrow;Would you like to see the data for tomorrow? Enter Y or N> ;Vil du se datasættet for i morgen også? Tast Y for ja og N for nej> ;
Continue;Would you like to check another day? Enter Y or N> ;Vil du teste endnu en dag? Tast Y for ja og N for nej> ;
Goodbye;Thank you for trying out our prototype!;Tak fordi du tog dig tid til at teste vores prototype!;